586,586,587,LKN 581,Uttar Pradesh,2006-07,Ballia,Shri Ram Cold Storage and Ice Factory,"Vill: Manpur Chit, Chitbaragaon, Dist: Ballia",0.0,6.83,Through NABARD,Completed,COLD / CA STORAGECOLD STORAGE05069.64MT
587,587,588,LKN 587,Uttar Pradesh,2006-07,Aligarh,Shri Ram Sharnam Cold Storage [Unit II],"Vill: Ratanpur, Khair, Aligarh",0.0,50.0,Through NABARD,Completed,COLD / CA STORAGECOLD STORAGE05583.21MT
588,588,589,LKN 588,Uttar Pradesh,2006-07,Rae Bareli,Shyamraj Cold Storage and Ice Factory,"C-4 to C-9, Bachhrawan Industrial Estate, Bachhrawan, Raebareli",0.0,50.0,Through NABARD,Completed,COLD / CA STORAGECOLD STORAGE05441.28MT
589,589,590,LKN 595,Uttar Pradesh,2006-07,Allahabad,Garib Nawaz Cold Storage and Ice Factory,"Vill: Bhagwatipur, Lalgopalganj, Allahabad",0.0,42.11,Through NABARD,Completed,COLD / CA STORAGECOLD STORAGE04915.88MT
590,590,591,LKN 593,Uttar Pradesh,2006-07,Kannauj,Habib Cold Storage (P) Ltd,"G.T. Road Bye Pass, Gursahaiganj, Kannauj",0.0,40.51,Through NABARD,Completed,COLD / CA STORAGECOLD STORAGE09417.47MT
591,591,592,LKN 590,Uttar Pradesh,2006-07,Ghazipur,Ishita Cold Storage and Ice (P) Ltd,"Vill: Deen Dayal Puram, Haveli Sadar, Dist: Ghazipur",0.0,47.76,Through NABARD,Completed,COLD / CA STORAGECOLD STORAGE05309.41MT
592,592,593,LKN 591,Uttar Pradesh,2006-07,Mathura,Maa Chandrakala Preservation (P) Ltd,"Vill: Hatkoli, Baldeo, Dist: Mathura",0.0,49.7,Through NABARD,Completed,COLD / CA STORAGECOLD STORAGE05711.86MT
593,593,594,LKN 589,Uttar Pradesh,2006-07,Agra,Om Shanti Ice and Cold Storage (P) Ltd,"Fatehabad, Agra",0.0,50.0,Through NABARD,Completed,COLD / CA STORAGECOLD STORAGE05417.78MT
594,594,595,LKN 594,Uttar Pradesh,2006-07,Hathras,Sumitra Devi Ice and Cold Storage (P) Ltd,"Mursan Road, Dhanoli, Sadabad, Dist: Hathras",0.0,50.0,Through NABARD,Completed,COLD / CA STORAGECOLD STORAGE06846.53MT
595,595,596,LKN 678,Uttar Pradesh,2006-07,Kannauj,M/s Laxmi Sheet Preservers (P) Limited,"Thatia, Tirva, Kannauj",0.0,28.79,Through NABARD,Completed,COLD / CA STORAGECOLD STORAGE03589.47MT
596,596,597,LKN 762,Uttar Pradesh,2006-07,Aligarh,Chaudhary Rashmi Cold Storage P Ltd,"Vill Lohsara, Khair Road, Aligarh",0.0,42.38,Through NABARD,Completed,COLD / CA STORAGECOLD STORAGE05775.11MT
597,597,598,LKN 661,Uttar Pradesh,2006-07,Kannauj,"M/s R.B Ice & Cold Storage, Chapunna, Tirwa, Kannauj","Post & Village Chapunna, Tehsil Tirwa, Kannauj",0.0,40.62,Through NABARD,Completed,COLD / CA STORAGECOLD STORAGE08017.06MT
598,598,599,LKN 592,Uttar Pradesh,2006-07,Agra,Alaipuriya Food and Cold Storage (P) Ltd,"Vill: Bharapur, Fatehabad, Agra",0.0,50.0,Through NABARD,Completed,COLD / CA STORAGECOLD STORAGE05214.61MT
599,599,600,LKN 598,Uttar Pradesh,2006-07,Agra,Baba Sheetgreh (P) Ltd,Baba Sheetgreh (P) Ltd,0.0,50.0,Through NABARD,Completed,COLD / CA STORAGECOLD STORAGE06505.97MT
600,600,601,LKN 596,Uttar Pradesh,2006-07,Aligarh,Harpyari Devi Cold Storage (P) Ltd,"Vill: Mai, Iglas, Dist: Aligarh",0.0,50.0,Through NABARD,Completed,COLD / CA STORAGECOLD STORAGE05714.33MT
601,601,602,LKN 599,Uttar Pradesh,2006-07,Hathras,Satish Chand Ramesh Chand Sheetgreh (P) Ltd,"Vill: Mansiya, Sadabad, Dist: Hathras",0.0,50.0,Through NABARD,Completed,COLD / CA STORAGECOLD STORAGE08904.04MT
602,602,603,LKN 597,Uttar Pradesh,2006-07,Hathras,Shree Chhitar Mal Sharma Cold Storage (P) Ltd,"Vill: Kakrawali, Hathras Road, Mursan Road, Hathras",0.0,50.0,Through NABARD,Completed,COLD / CA STORAGECOLD STORAGE06950.36MT
603,603,604,LKN 600,Uttar Pradesh,2006-07,Kannauj,Shri Gurukripa Sheetalaya (P) Ltd,"Vill: Mauja Udaitpur, Dist: Kannauj",0.0,37.01,Through NABARD,Completed,COLD / CA STORAGECOLD STORAGE08904.04MT
604,604,605,LKN 654,Uttar Pradesh,2006-07,Agra,M/s Shree Ganesh Ice & Cold Storage,"Khasra No.132, Village Mauza Gadauli Khurd, Fatehabad, Devari-Idarat Road, Agra",0.0,50.0,Through NABARD,Completed,COLD / CA STORAGECOLD STORAGE05226.66MT
605,605,606,LKN 604,Uttar Pradesh,2006-07,Kanpur Nagar,Priyadarshini Cold Storage,"Vill: Bakothi, Tehsil: Bilhaur, Dist: Kanpur Nagar",0.0,44.83,Through NABARD,Completed,COLD / CA STORAGECOLD STORAGE08055.35MT
606,606,607,LKN 602,Uttar Pradesh,2006-07,Kannauj,Rehman Cold Storage,"Vill: Bahadurpur Ujjaina, Makrand Nagar, Dist: Kannauj",0.0,42.51,Through NABARD,Completed,COLD / CA STORAGECOLD STORAGE07515.12MT
607,607,608,LKN 603,Uttar Pradesh,2006-07,Kanpur Nagar,Uma Shankar Katiyar Cold Storage,"Vill: Merva, Araul, Tehsil: Bilhaur, Dist: Kanpur Nagar, 05122582317, 2580951",0.0,35.38,Through NABARD,Completed,COLD / CA STORAGECOLD STORAGE010845.28MT
608,608,609,LKN 601,Uttar Pradesh,2006-07,Kannauj,Vishwanath Cold Storage,"Vill: Faguha, Tirwa Kannauj Road, Dist: Kannauj",0.0,33.12,Through NABARD,Completed,COLD / CA STORAGECOLD STORAGE010202.01MT
609,609,610,LKN 606,Uttar Pradesh,2006-07,Firozabad,H.C. Garg Ice and Cold Storage (P) Ltd,"Vill: Satoli, Etmadpur, Dist: Firozabad",0.0,3.99,Through NABARD,Completed,COLD / CA STORAGECOLD STORAGE010665.73MT
610,610,611,LKN 607,Uttar Pradesh,2006-07,Agra,Jitendra Ice and Cold Storage (P) Ltd,"Vill: Gopau, Kirawali, Agra",0.0,25.0,Through NABARD,Completed,COLD / CA STORAGECOLD STORAGE03374.85MT
611,611,612,LKN 657,Uttar Pradesh,2006-07,Firozabad,M/s Nidhi Cold Storage,"Khasra No.157G & 157H, Village Sikrari, Etah Road, Tundla, District Firozabad",0.0,50.0,Through NABARD,Completed,COLD / CA STORAGECOLD STORAGE07549.49MT
612,612,613,LKN 656,Uttar Pradesh,2006-07,Firozabad,M/s Shri. Bhopleshwar Sheetgrah Pvt Ltd,"Khasra No.157K & 157KH, Village Sikrari, Etah Road, Tundla, District Firozabad",0.0,38.39,Through NABARD,Completed,COLD / CA STORAGECOLD STORAGE03839.18MT
613,613,614,LKN 665,Uttar Pradesh,2006-07,Bijnor,M/s Aman Cold Storage,"Kiratpur, Bijnor",0.0,28.25,Through NABARD,Completed,COLD / CA STORAGECOLD STORAGE04457.18MT
614,614,615,LKN 608,Uttar Pradesh,2006-07,Firozabad,Moon Sheetalaya (P) Ltd,"V - Indumai, Makkhanpur, Dist: Firozabad",0.0,49.44,Through NABARD,Completed,COLD / CA STORAGECOLD STORAGE05245.12MT
615,615,616,LKN 609,Uttar Pradesh,2006-07,Bahraich,R.K. Cold Storage and Allied Industries,"Sheo Nagar, Gonda Road, Bahraich",0.0,17.79,Through NABARD,Completed,COLD / CA STORAGECOLD STORAGE01779.19MT
616,616,617,LKN 611,Uttar Pradesh,2006-07,Ghazipur,Shree Visharadji Cold Storage,"Mauza Bisunpura (Raghubarganj), Mahmoodabad, Dist: Ghazipur",0.0,45.16,Through NABARD,Completed,COLD / CA STORAGECOLD STORAGE05881.05MT
617,617,618,LKN 610,Uttar Pradesh,2006-07,Gorakhpur,Vijay Bahadur Cold Storage,"Plot: BL 2B and 3, Sector 13, G.I.D.A., Gorakhpur",0.0,34.61,Through NABARD,Completed,COLD / CA STORAGECOLD STORAGE03460.97MT
618,618,619,LKN 612,Uttar Pradesh,2006-07,Ballia,Anand Onion Storage,"Vill: Basawaria, Dhanawati, Tehsil: Bansdih, Dist: Ballia",0.0,1.66,Through NABARD,Completed,COLD / CA STORAGECOLD STORAGE0331.50MT
619,619,620,LKN 658,Uttar Pradesh,2006-07,Ghazipur,Purvanchal Cold Storage,"Village Safapur, Post Tandwan, Tehsil Mohammadabad, Ghazipur",0.0,40.21,Through NABARD,Completed,COLD / CA STORAGECOLD STORAGE04807.87MT
620,620,621,LKN 613,Uttar Pradesh,2006-07,Agra,Kushwaha Sheetgreh (P) Ltd,"Vill: Vas Mahua, Patti Bhanpura, Shamshabad, Agra",0.0,50.0,Through NABARD,Completed,COLD / CA STORAGECOLD STORAGE05027.91MT
621,621,622,LKN 614,Uttar Pradesh,2006-07,Agra,Bombay Cold Storage (P) Ltd,"Mauza Ramnagar, Etmadpur, Agra",0.0,50.0,Through NABARD,Completed,COLD / CA STORAGECOLD STORAGE05857.38MT
622,622,623,LKN 615,Uttar Pradesh,2006-07,Agra,Ujala Cold Storage,"Pili Pokhar, Poiya Chauraha, Hathras Road, Agra",0.0,50.0,Through NABARD,Completed,COLD / CA STORAGECOLD STORAGE05087.44MT
623,623,624,LKN 744,Uttar Pradesh,2006-07,Shahjahanpur,RM Cold Storage Pvt Ltd. ( Unit II),"Miranpur Katra, Shahjahanpur",0.0,23.08,Through NABARD,Completed,COLD / CA STORAGECOLD STORAGE02307.76MT
624,624,625,LKN 616,Uttar Pradesh,2006-07,Agra,Radhey Radhey Sheetgreh (P) Ltd,"Vill: Baragaon, Shamshabad, Dist: Agra",0.0,50.0,Through NABARD,Completed,COLD / CA STORAGECOLD STORAGE06223.31MT
625,625,626,LKN 683,Uttar Pradesh,2006-07,Allahabad,M/s Annapurna Sheetalaya P Ltd,Vill: & Post Bhagautipur,0.0,46.15,Through NABARD,Completed,COLD / CA STORAGECOLD STORAGE04615.40MT
626,626,627,LKN 617,Uttar Pradesh,2006-07,Hathras,Master Jaswant Ice and Cold Storage (P) Ltd,"Mursan - Sadabad Road, Mursan, Dist: Hathras",0.0,50.0,Through NABARD,Completed,COLD / CA STORAGECOLD STORAGE06128.41MT
627,627,628,LKN 619,Uttar Pradesh,2006-07,Unnao,Chandralok Sheetalaya (P) Ltd,"Vill: Jagatpur, Bangarmau, Dist: Unnao",0.0,20.72,Through NABARD,Completed,COLD / CA STORAGECOLD STORAGE02495.71MT
628,628,629,LKN 618,Uttar Pradesh,2006-07,Pratapgarh,Jai Ambay Cold Storage,"Vill: Lakhahara, Sangipur, Dist: Pratapgarh",0.0,38.0,Through NABARD,Completed,COLD / CA STORAGECOLD STORAGE06560.00MT
629,629,630,LKN 621,Uttar Pradesh,2006-07,Agra,Dakshkanya Cold Storage (P) Ltd,"Vill: Gopalpura, Bhadarauli, Bah, Dist: Agra",0.0,50.0,Through NABARD,Completed,COLD / CA STORAGECOLD STORAGE07815.84MT
630,630,631,LKN 622,Uttar Pradesh,2006-07,Budaun,Shyam Cold Storage (P) Ltd,"Shyam Nagar, Badaun",0.0,8.46,Through NABARD,Completed,COLD / CA STORAGECOLD STORAGE03382.94MT
631,631,632,LKN 620,Uttar Pradesh,2006-07,Aligarh,Soniji Ice and Cold Storage,"Vill: Manpur Khurd, Khair, Dist: Aligarh",0.0,47.95,Through NABARD,Completed,COLD / CA STORAGECOLD STORAGE04795.14MT
632,632,633,LKN 747,Uttar Pradesh,2006-07,Kannauj,Hindustan Cold Storage,"Sartop, Jalalpur Panwara, Kannauj",0.0,3.03,Through NABARD,Completed,COLD / CA STORAGECOLD STORAGE0303.00MT
633,633,634,LKN 623,Uttar Pradesh,2006-07,Hathras,Pahlawat Ice and Cold Storage (P) Ltd,"Vill: Kota, Hathras - Dauji Road, Dist: Hathras",0.0,50.0,Through NABARD,Completed,COLD / CA STORAGECOLD STORAGE06167.79MT
634,634,635,LKN 624,Uttar Pradesh,2006-07,Agra,M.L.D.C. Ice and Cold Storage,"Vill: Nagla Udaiya, Kheragarh, Dist: Agra",0.0,45.14,Through NABARD,Completed,COLD / CA STORAGECOLD STORAGE04513.95MT
635,635,636,LKN 626,Uttar Pradesh,2006-07,Firozabad,"Aman Cold Storage (P) Ltd, SPECIAL CASE","Mainpuri Road, Shikohabad, Dist: Firozabad",0.0,44.93,Through NABARD,Completed,COLD / CA STORAGECOLD STORAGE07248.09MT
636,636,637,LKN 625,Uttar Pradesh,2006-07,Firozabad,Ramnath Singh Sheetgreh (P) Ltd,"Vill: Kabirpur, Sirsaganj, Dist: Firozabad",0.0,43.54,Through NABARD,Completed,COLD / CA STORAGECOLD STORAGE05654.79MT
637,637,638,LKN 679,Uttar Pradesh,2006-07,Hathras,M/s RL Sharma Cold Storage (P) Ltd,Jalesar Road,0.0,50.0,Through NABARD,Completed,COLD / CA STORAGECOLD STORAGE06195.26MT
638,638,639,LKN 680,Uttar Pradesh,2006-07,Agra,M/s Tanguria Cold Storage (P) Ltd,Vill: Kutakpur Rohai,0.0,50.0,Through NABARD,Completed,COLD / CA STORAGECOLD STORAGE07763.47MT
639,639,640,LKN 745,Uttar Pradesh,2006-07,Kannauj,Asha Cold Storage,"Village: Kishuapur, Post: Jasoda, Kannauj",0.0,34.43,Through NABARD,Completed,COLD / CA STORAGECOLD STORAGE010334.05MT
640,640,641,LKN 629,Uttar Pradesh,2006-07,Firozabad,B.D.S. Cold Storage (P) Ltd,"Vill: Sarai Lukman, Sirsaganj, Dist: Firozabad",0.0,43.83,Through NABARD,Completed,COLD / CA STORAGECOLD STORAGE06311.31MT
641,641,642,LKN 636,Uttar Pradesh,2006-07,Firozabad,B.S.A. Cold Storage (P) Ltd,"Vill: Indergarh, Sirsaganj, Dist: Firozabad",0.0,46.24,Through NABARD,Completed,COLD / CA STORAGECOLD STORAGE06352.39MT
642,642,643,LKN 630,Uttar Pradesh,2006-07,Firozabad,Jay Bholenath Cold Storage (P) Ltd,"Vill: Rudhawali, Etawah Road, Sirsaganj, Dist: Firozabad",0.0,45.27,Through NABARD,Completed,COLD / CA STORAGECOLD STORAGE06340.96MT
643,643,644,LKN 655,Uttar Pradesh,2006-07,Hathras,M/s Shri Krishna Cold Storage & Allied Industries Unit II,"Village Bijahari, Sasni, District Hathras",0.0,25.04,Through NABARD,Completed,COLD / CA STORAGECOLD STORAGE02504.35MT
644,644,645,LKN 628,Uttar Pradesh,2006-07,Firozabad,Maa Bhagwati Sheetgreh (P) Ltd,"Vill: Dakhinara, Shikohabad, Dist: Firozabad",0.0,45.92,Through NABARD,Completed,COLD / CA STORAGECOLD STORAGE05556.84MT
645,645,646,LKN 635,Uttar Pradesh,2006-07,Firozabad,R.P. Sheetgreh (P) Ltd,"Vill: Sarai Lukman, Sirsaganj, Dist: Firozabad",0.0,41.89,Through NABARD,Completed,COLD / CA STORAGECOLD STORAGE05567.43MT
646,646,647,LKN 640,Uttar Pradesh,2006-07,Firozabad,S.D. Sheetgreh (P) Ltd,"Vill: Rudhemai, Etawah Road, Sirsaganj, Dist: Firozabad",0.0,45.05,Through NABARD,Completed,COLD / CA STORAGECOLD STORAGE06465.55MT
647,647,648,LKN 627,Uttar Pradesh,2006-07,Agra,Sanjay Sheetgreh and Chilling plant (P) Ltd,"Mauza Karondhna, Fatehabad, Dist: Agra",0.0,50.0,Through NABARD,Completed,COLD / CA STORAGECOLD STORAGE06797.29MT
648,648,649,LKN 634,Uttar Pradesh,2006-07,Kannauj,Sarojani Cold Storage,"Vill: Sarotop, Govardhani Tiraha, G.T. Road, Dist: Kannauj",0.0,46.12,Through NABARD,Completed,COLD / CA STORAGECOLD STORAGE07992.38MT
649,649,650,LKN 638,Uttar Pradesh,2006-07,Kaushambi,Shiv Sagar Cold Storage,"Sirathu, Dist: Kaushambi",0.0,40.81,Through NABARD,Completed,COLD / CA STORAGECOLD STORAGE05116.12MT
650,650,651,LKN 632,Uttar Pradesh,2006-07,Agra,Shree Giriraj Sheetgreh (P) Ltd,"Vill: Digner, Shamshabad Road, Dist: Agra",0.0,35.0,Through NABARD,Completed,COLD / CA STORAGECOLD STORAGE03503.14MT
651,651,652,LKN 633,Uttar Pradesh,2006-07,Aligarh,Shree Jagdamba Ice and Cold Storage (Unit II),"Vill: Sahara, Iglas, Dist: Aligarh",0.0,50.0,Through NABARD,Completed,COLD / CA STORAGECOLD STORAGE06806.55MT
652,652,653,LKN 637,Uttar Pradesh,2006-07,Azamgarh,Shree Sai Pyaz Bhandaran Kendra,"Vill: Barhi, Barhalganj, Dist: Azamgarh",0.0,0.95,Through NABARD,Completed,COLD / CA STORAGECOLD STORAGE0190.00MT
653,653,654,LKN 631,Uttar Pradesh,2006-07,Kannauj,Shri Narain Cold Storage,"Vill: Manimau, G.T. Road, Dist: Kannauj",0.0,40.81,Through NABARD,Completed,COLD / CA STORAGECOLD STORAGE08308.12MT
654,654,655,LKN 639,Uttar Pradesh,2006-07,Firozabad,Shri Sileti Singh Cold Storage (P) Ltd,"Vill: Dakhinara, Shikohabad, Dist: Firozabad",0.0,44.7,Through NABARD,Completed,COLD / CA STORAGECOLD STORAGE040295.00MT
655,655,656,LKN 660,Uttar Pradesh,2006-07,Allahabad,M/s Mansuri Cold Storage & Ice Factory,"Village : Samahi, Nawabganj, Tehsil : Soraon, Allahabad",0.0,50.0,Through NABARD,Completed,COLD / CA STORAGECOLD STORAGE05021.30MT
656,656,657,LKN 674,Uttar Pradesh,2006-07,Ghazipur,Swatantra Cold Storage (P) Ltd,"Vill: Hansrajpur, Ghazipur",0.0,27.73,Through NABARD,Completed,COLD / CA STORAGECOLD STORAGE02772.93MT
657,657,658,LKN 673,Uttar Pradesh,2006-07,Hardoi,Balaji Cold Storage Unit-2,"Hardoi - Sahabad Road, Hardoi",0.0,48.32,Through NABARD,Completed,COLD / CA STORAGECOLD STORAGE04898.03MT
658,658,659,LKN 659,Uttar Pradesh,2006-07,Ghazipur,M/s Awadh Cold Storage & Ice Plant,"Nasirpur(Near Chaukia More), Ghazipur",0.0,49.66,Through NABARD,Completed,COLD / CA STORAGECOLD STORAGE05416.48MT
659,659,660,LKN 641,Uttar Pradesh,2007-08,Kannauj,Awasthi Cold Storage (P) Ltd,"Vill: Kirpalpur, Thathia, Dist: Kannauj",0.0,50.0,Through NABARD,Completed,COLD / CA STORAGECOLD STORAGE07919.97MT
660,660,661,LKN 706,Uttar Pradesh,2007-08,Ghazipur,Jagdamba Cold Storage,Vill: Birno Ghazipur,0.0,47.58,Through NABARD,Completed,COLD / CA STORAGECOLD STORAGE04757.94MT
661,661,662,LKN 746,Uttar Pradesh,2007-08,Kannauj,Kripa Shanker Devendra Kumar Cold Storage (P) Ltd,"Tirwa Road, Kannauj",0.0,50.0,Through NABARD,Completed,COLD / CA STORAGECOLD STORAGE07421.39MT
662,662,663,LKN 652,Uttar Pradesh,2007-08,Moradabad,M/s Janta Cold Storage & Ice Factory,"Adampur Road, Sambhal, District Moradabad",0.0,50.0,Through NABARD,Completed,COLD / CA STORAGECOLD STORAGE05617.22MT
663,663,664,LKN 677,Uttar Pradesh,2007-08,Moradabad,M/s Krishna Cold Storage & Allied Industries,"Village Khirni, Mohiuddinpur, Sambhal Adampur Road, Tehsil Sambhal, Moradabad",0.0,49.32,Through NABARD,Completed,COLD / CA STORAGECOLD STORAGE05258.50MT
664,664,665,LKN 653,Uttar Pradesh,2007-08,Hardoi,M/s Mallawan Cold Storage Pvt. Ltd. (Unit II),"Vill: Pasner, Sandi Road, Bilgram, District Hardoi",0.0,44.27,Through NABARD,Completed,COLD / CA STORAGECOLD STORAGE05096.52MT
665,665,666,LKN 667,Uttar Pradesh,2007-08,Aligarh,M/s Munni Lal Ice & Cold Storage (P) Ltd,"Vill : Saharanpur, Aligarh",0.0,49.17,Through NABARD,Completed,COLD / CA STORAGECOLD STORAGE05207.18MT
666,666,667,LKN 670,Uttar Pradesh,2007-08,Ghazipur,M/s Purvanchal Pyaz Storage,"Vill: Bhaksi, Post: Dildarnagar, Zamania, Ghazipur",0.0,11.13,Through NABARD,Completed,COLD / CA STORAGECOLD STORAGE02226.17MT
667,667,668,LKN 675,Uttar Pradesh,2007-08,Kannauj,Shakir Ali Cold Storage (P) Ltd,"CSB Road, Saurikh, Kannauj",0.0,50.0,Through NABARD,Completed,COLD / CA STORAGECOLD STORAGE07070.45MT
668,668,669,LKN 763,Uttar Pradesh,2007-08,Kannauj,Sitaram Cold Storage,"Nazrapur, Kannauj",0.0,12.83,Through NABARD,Completed,COLD / CA STORAGECOLD STORAGE01282.94MT
669,669,670,LKN 642,Uttar Pradesh,2007-08,Shahjahanpur,R. K. Cold Storage,"Mishripur, Rosar Kothi, Dist: Shahjahanpur",0.0,22.32,Through NABARD,Completed,COLD / CA STORAGECOLD STORAGE02232.00MT
670,670,671,LKN 643,Uttar Pradesh,2007-08,Rae Bareli,Kacchawah Cold Storage (P) Ltd,"Itoura Buzurg, Unchahar, Dist: Raebareli",0.0,50.0,Through NABARD,Completed,COLD / CA STORAGECOLD STORAGE05005.44MT
671,671,672,LKN 645,Uttar Pradesh,2007-08,Agra,Megh Singh Ice and Cold Storage (P) Ltd,"Vill: Nadau, Jalesar Road, Dist: Agra",0.0,47.82,Through NABARD,Completed,COLD / CA STORAGECOLD STORAGE06077.15MT
672,672,673,LKN 644,Uttar Pradesh,2007-08,Agra,Raman Behari Ice and Cold Storage,"Vill: Nadau, Jalesar Road, Dist: Agra",0.0,50.0,Through NABARD,Completed,COLD / CA STORAGECOLD STORAGE05853.72MT
673,673,674,LKN 648,Uttar Pradesh,2007-08,Hathras,Bholenath Sheetgreh (P) Ltd,"Vill: Govindpur, Kanjauli, Dist: Hathras",0.0,50.0,Through NABARD,Completed,COLD / CA STORAGECOLD STORAGE05893.13MT
674,674,675,LKN 647,Uttar Pradesh,2007-08,Kaushambi,Maa Sharda Cold Storage,"Samda, Manjhanpur, Dist: Kaushambi, 9838653679",0.0,47.19,Through NABARD,Completed,COLD / CA STORAGECOLD STORAGE04822.81MT
675,675,676,LKN 646,Uttar Pradesh,2007-08,Agra,Nataraj Ice and Cold Storage,"E-18, Foundry Nagar, Agra",0.0,9.53,Through NABARD,Completed,COLD / CA STORAGECOLD STORAGE0976.08MT
676,676,677,LKN 649,Uttar Pradesh,2007-08,Pilibhit,Pilibhit Cold Storage,"Jaswantari Road, Near Power House, Nakhasa, Pilibhit",0.0,6.34,Through NABARD,Completed,COLD / CA STORAGECOLD STORAGE0819.13MT
677,677,678,LKN 650,Uttar Pradesh,2007-08,Rae Bareli,Siddhi Vinayak Sheetgreh (P) Ltd,"VillL Dubhan, Salon, Dist: Raebareli",0.0,47.76,Through NABARD,Completed,COLD / CA STORAGECOLD STORAGE04775.85MT
678,678,679,LKN 819,Uttar Pradesh,2007-08,Ballia,Surahaiya Cold Storage,"Mauza Dharwar (Surahaiya) Post Sahatwar, Ballia",0.0,9.48,Through NABARD,Completed,COLD / CA STORAGECOLD STORAGE04570.22MT
679,679,680,LKN 651,Uttar Pradesh,2007-08,Mathura,M/s Robin Cold Storage,"Mauza Saras, Sadabad Road, Raya, Dist: Mathura",0.0,43.41,Through NABARD,Completed,COLD / CA STORAGECOLD STORAGE04340.84MT
680,680,681,09UP2007000085,Uttar Pradesh,2007-08,Basti,Suyash Cold Storage and Ice Factory,"Village - Amoil, District Basti, P.O. Hathiyagarh (UP)",0.0,10.89,NHB,Completed,COLD / CA STORAGECOLD STORAGE01089.00MT
681,681,682,LKN 663,Uttar Pradesh,2007-08,Bijnor,M/s Agarwal Ice & Cold Storage,"Akbarabad Road, Kiratpur, Bijnor",0.0,31.06,Through NABARD,Completed,COLD / CA STORAGECOLD STORAGE03105.82MT
682,682,683,LKN 669,Uttar Pradesh,2007-08,Mathura,Behari Cold Storage Pvt. Ltd,"Vill: Jataura, Mathura Sadabad Road, Po: Averani, Mathura",0.0,50.0,Through NABARD,Completed,COLD / CA STORAGECOLD STORAGE06312.60MT
683,683,684,LKN 713,Uttar Pradesh,2007-08,Etawah,Shabnam Cold Storage,"Kanpur Road, Etawah",0.0,23.05,Through NABARD,Completed,COLD / CA STORAGECOLD STORAGE02322.61MT
684,684,685,LKN 664,Uttar Pradesh,2007-08,Rae Bareli,M/S Devendra Sheetgreh Pvt. Ltd,"Vill: Manchitpur, Amawan, Tehsil: Maharajganj, Rae Bareli",0.0,50.0,Through NABARD,Completed,COLD / CA STORAGECOLD STORAGE06270.80MT
685,685,686,LKN 708,Uttar Pradesh,2007-08,Etawah,Tirupati Cold Storage,"Mainpuri Road, Etawah",0.0,46.12,Through NABARD,Completed,COLD / CA STORAGECOLD STORAGE04635.37MT
686,686,687,LKN 707,Uttar Pradesh,2007-08,Agra,Mahalaxmi Sheetalaya,"Gari Dariyab, Agra",0.0,50.0,Through NABARD,Completed,COLD / CA STORAGECOLD STORAGE05139.93MT
687,687,688,LKN 668,Uttar Pradesh,2007-08,Hathras,R B Sheetgrah Pvt Ltd,"Vill & Post Koka, Hathras",0.0,50.0,Through NABARD,Completed,COLD / CA STORAGECOLD STORAGE05764.82MT
688,688,689,LKN 671,Uttar Pradesh,2007-08,Agra,Maya Devi Cold Storage,"Village:Ujrai, Agra",0.0,50.0,Through NABARD,Completed,COLD / CA STORAGECOLD STORAGE06537.93MT
689,689,690,LKN 666,Uttar Pradesh,2007-08,Bareilly,M/s Allied Cold Storage & Ice Factory,"Vill : Simra, Bareilly",0.0,48.47,Through NABARD,Completed,COLD / CA STORAGECOLD STORAGE04846.66MT
690,690,691,LKN 672,Uttar Pradesh,2007-08,Agra,Vaidya Ji Sheetgrah (P) Ltd,"Vaidya Ji Farms, Agra",0.0,50.0,Through NABARD,Completed,COLD / CA STORAGECOLD STORAGE07022.11MT
691,691,692,LKN 731,Uttar Pradesh,2007-08,Azamgarh,Jai Bajrang Pyaz Sanrakshan kendra,"Vill : Tiwaria Khurd, PO Khurasa, Dist: Azamgarh",0.0,1.3,Through NABARD,Completed,COLD / CA STORAGECOLD STORAGE0260.91MT
692,692,693,LKN 686,Uttar Pradesh,2007-08,Hathras,M/s Shree Ganga Sheetgrah (P) Ltd,"Vill: Jogia, Iglas Road",0.0,49.38,Through NABARD,Completed,COLD / CA STORAGECOLD STORAGE05458.46MT
693,693,694,LKN 681,Uttar Pradesh,2007-08,Agra,M/s LD Agrotech (P) Ltd,Shamshabad-Fatehabad Road,0.0,50.0,Through NABARD,Completed,COLD / CA STORAGECOLD STORAGE011586.94MT
694,694,695,LKN 704,Uttar Pradesh,2007-08,Aligarh,Ram Pyari Cold Storage,"Pinjari Nagari, Gonda Road,",0.0,48.95,Through NABARD,Completed,COLD / CA STORAGECOLD STORAGE07475.41MT
695,695,696,LKN 676,Uttar Pradesh,2007-08,Hardoi,Balaji Cold Storage Unit-1,"Hardoi - Sahabad Road, Hardoi",0.0,48.32,Through NABARD,Completed,COLD / CA STORAGECOLD STORAGE05088.49MT
696,696,697,LKN 698,Uttar Pradesh,2007-08,Agra,Dhan Devi Cold Storage,"Kh.No.93, Mauza Chausangi, Bhadrauli, Bah, Agra",0.0,49.93,Through NABARD,Completed,COLD / CA STORAGECOLD STORAGE06714.40MT
697,697,698,LKN 682,Uttar Pradesh,2007-08,Agra,M/s Bhudevi Cold Storage P Ltd.,Vill: Kundol,0.0,50.0,Through NABARD,Completed,COLD / CA STORAGECOLD STORAGE06041.02MT
698,698,699,LKN 684,Uttar Pradesh,2007-08,Agra,M/s R V P Cold Storage (P) Ltd,Vill: Bagal Ghusa,0.0,50.0,Through NABARD,Completed,COLD / CA STORAGECOLD STORAGE07794.38MT
699,699,700,LKN 685,Uttar Pradesh,2007-08,Agra,M/s Ramashish Sheetalaya Pvt Ltd,Vill: Gehnu,0.0,50.0,Through NABARD,Completed,COLD / CA STORAGECOLD STORAGE06316.80MT
700,700,701,LKN 732,Uttar Pradesh,2007-08,Allahabad,Prasun Kumar Prashant Kumar Sheetgrah,"Gohari Road, Phaphamau, Allahabad",0.0,37.93,Through NABARD,Completed,COLD / CA STORAGECOLD STORAGE03792.47MT
701,701,702,LKN 735,Uttar Pradesh,2007-08,Mathura,"Hari Om Gautam Cold Storage & Ice Factory, Patloni, Mathura","Vill: Patloni, Mathura",0.0,50.0,Through NABARD,Completed,COLD / CA STORAGECOLD STORAGE05441.28MT
702,702,703,LKN 703,Uttar Pradesh,2007-08,Kannauj,Sheetal Sheetalaya,"GT Road, Karmullapur, Sikandarpur",0.0,46.93,Through NABARD,Completed,COLD / CA STORAGECOLD STORAGE04693.19MT
703,703,704,LKN 705,Uttar Pradesh,2007-08,Ghazipur,Ramlal Cold Storage,"Industrial Estate, Nawabganj",0.0,25.0,Through NABARD,Completed,COLD / CA STORAGECOLD STORAGE03197.88MT
704,704,705,LKN 729,Uttar Pradesh,2007-08,Agra,R M Pachauri Sheetgrah (P) Ltd,"Village & PO Bah, Agra Road",0.0,50.0,Through NABARD,Completed,COLD / CA STORAGECOLD STORAGE06038.34MT
705,705,706,LKN 701,Uttar Pradesh,2007-08,Agra,Lalita Cold Storage,"Khasra No.615, Madayana, Sikara, Fatehabad, Agra",0.0,45.55,Through NABARD,Completed,COLD / CA STORAGECOLD STORAGE07080.37MT
706,706,707,LKN 693,Uttar Pradesh,2007-08,Kannauj,Ziya Cold Storage,"Mahmoodpur Khas, Gunwarpur Banwari, Chhibramau, Kannauj",0.0,50.0,Through NABARD,Completed,COLD / CA STORAGECOLD STORAGE03654.91MT
707,707,708,LKN 689,Uttar Pradesh,2007-08,Agra,Bhagbhan Devi Ice & Cold Storage,"10.2, K.M.Stone, Tedi Bagaia, Jalesar Road, Agra",0.0,17.76,Through NABARD,Completed,COLD / CA STORAGECOLD STORAGE01776.01MT
708,708,709,LKN 690,Uttar Pradesh,2007-08,Agra,Raj Rajeshwari Maa Cold Storage,"Kh No. 1183, Agra",0.0,50.0,Through NABARD,Completed,COLD / CA STORAGECOLD STORAGE05418.59MT
709,709,710,LKN 692,Uttar Pradesh,2007-08,Agra,S.J.Ice & Cold Storage,"215, Siroli, Near Dhanoli Road, Agra",0.0,50.0,Through NABARD,Completed,COLD / CA STORAGECOLD STORAGE05066.40MT
710,710,711,LKN 691,Uttar Pradesh,2007-08,Hathras,Satya Shakti Cold Storage,"Kh.No. 103, Vil.Gursauti, Tehsil Sadabad",0.0,50.0,Through NABARD,Completed,COLD / CA STORAGECOLD STORAGE05598.35MT
711,711,712,LKN 702,Uttar Pradesh,2007-08,Agra,Umapati Cold Storage,"Kh.No.840, Mauza Bharapur, Fatehabad",0.0,50.0,Through NABARD,Completed,COLD / CA STORAGECOLD STORAGE05399.22MT
712,712,713,LKN 696,Uttar Pradesh,2007-08,Agra,Har Har Gange Cold Storage,"Bharapur Road, Fatehabad, Agra",0.0,50.0,Through NABARD,Completed,COLD / CA STORAGECOLD STORAGE05441.20MT
713,713,714,LKN 697,Uttar Pradesh,2007-08,Aligarh,Jats Cold Storage,"Mauza Beswan, Jahroli Mode, Tehsil Iglas, Aligarh",0.0,50.0,Through NABARD,Completed,COLD / CA STORAGECOLD STORAGE05053.13MT
714,714,715,LKN 694,Uttar Pradesh,2007-08,Agra,Ram Sheetgrah (P) Ltd,"Kh.No.1320, 1321-Pili Pokhar, Hathras Road, Agra",0.0,50.0,Through NABARD,Completed,COLD / CA STORAGECOLD STORAGE07447.24MT
715,715,716,LKN 695,Uttar Pradesh,2007-08,Ghazipur,M/s Vimla Cold Storage,Sonahuliya (Bakuliapur),0.0,48.42,Through NABARD,Completed,COLD / CA STORAGECOLD STORAGE04949.95MT
716,716,717,LKN 715,Uttar Pradesh,2007-08,Agra,Atul Ice & Cold Storage,"Khasra No.635/4, Village Ram Nagar, Khandoli, Agra",0.0,50.0,Through NABARD,Completed,COLD / CA STORAGECOLD STORAGE05834.29MT
717,717,718,LKN 709,Uttar Pradesh,2007-08,Agra,Jai Kaila Devi Cold Storage & Ice Factory,"Sikandra, Opp. Sabzi Mandi, Agra",0.0,8.1,Through NABARD,Completed,COLD / CA STORAGECOLD STORAGE0809.66MT
